<?xml version="1.0" encoding="ISO-8859-1" ?>
<!DOCTYPE scenario SYSTEM "../sipp.dtd">

<scenario>

<Global variables="userId,luserAdd,domain,ua,luserIpPort">
  <action>
    <assign assign_to="userId" value="0" />
  </action>
</Global>

<nop>
  <action>
    <add assign_to="userId" value="1" />
    <assignstr assign_to="luserIpPort" value="[local_ip]:[local_port]" />   
    <assignstr assign_to="luserAdd" value="sip:user0.000000@[$domain]" />
    <assignstr assign_to="ruserAdd" value="sip:user[$userId]@[$domain]" /> 
  </action>
</nop>


  <send>
    <![CDATA[

      MESSAGE [$ruserAdd] SIP/2.0
      Via: SIP/2.0/[transport] [$luserIpPort];branch=[branch]
      From: <[$luserAdd]>;tag=[pid]SIPpTag00[call_number]
      To: <[$ruserAdd]>
      Call-ID: [call_id]
      User-Agent: [$ua]
      CSeq: 1 MESSAGE
      Contact: [$luserAdd]
      Max-Forwards: 70
      Content-Type: text/plain
      Content-Length: [len]

      Hello World user[$userId]!

    ]]>
  </send>

  <recv response="100" optional="true"></recv>
  <recv response="407" auth="true" timeout="2000"></recv>

  <send>
    <![CDATA[

      MESSAGE [$ruserAdd] SIP/2.0
      Via: SIP/2.0/[transport] [$luserIpPort];branch=[branch]
      From: <[$luserAdd]>;tag=[pid]SIPpTag00[call_number]
      To: <[$ruserAdd]>
      Call-ID: [call_id]
      User-Agent: [$ua]
      CSeq: 2 MESSAGE
      Contact: [$luserAdd]
      Max-Forwards: 70
      Content-Type: text/plain
      Content-Length: [len]
      [field0]

      Hello World user[$userId]!

    ]]>
  </send>

  <recv response="100" optional="true"></recv>
  <recv response="200" rtd="true" timeout="2000"></recv>


  <ResponseTimeRepartition value="10, 20, 30, 40, 50, 100, 150, 200"/>
  <CallLengthRepartition value="10, 50, 100, 500, 1000, 5000, 10000"/>

</scenario>

