<?xml version="1.0" encoding="UTF-8" ?>
<!DOCTYPE scenario SYSTEM "sipp.dtd">

<scenario name="Register one user with authentication">

<Global variables="userId,luserIpPort,domain,ua,expire">
  <action>
    <assign assign_to="userId" value="0" />
  </action>
</Global>

<nop hide="true">
  <action>
    <add assign_to="userId" value="1" /> <!-- strangely, now userId=1.000000-->
    <assignstr assign_to="luserIpPort" value="[local_ip]:[local_port]" />
    <assignstr assign_to="luserAddContact" value="sip:user[$userId]@[local_ip]:5063" />
    <assignstr assign_to="ruserAdd" value="sip:user[$userId]@[$domain]" />
  </action>
</nop>


  <send>
    <![CDATA[
    REGISTER sip:[remote_ip] SIP/2.0
	Via: SIP/2.0/[transport] [$luserIpPort];branch=[branch]
	From: [$ruserAdd];tag=[pid]SIPpTag00[call_number]
	To: [$ruserAdd]
	Call-ID: [call_id]
	CSeq: 1 REGISTER
	Contact: [$luserAddContact]
	Max-Forwards: 70
	User-Agent: [$ua]
	Expires: [$expire]
	Content-Length: 0
    ]]>
  </send>

  <recv response="100" optional="true"></recv>
  <recv response="401" auth="true"></recv>


  <send>
    <![CDATA[
    REGISTER sip:[remote_ip] SIP/2.0
        Via: SIP/2.0/[transport] [$luserIpPort];branch=[branch]
        From: [$ruserAdd];tag=[pid]SIPpTag00[call_number]
        To: [$ruserAdd]
        Call-ID: [call_id]
        CSeq: 2 REGISTER
        Contact: [$luserAddContact]
        [field0]
        Max-Forwards: 70
        User-Agent: [$ua]
        Expires: [$expire]
        Content-Length: 0
    ]]>
  </send>

  <recv response="100" optional="true"></recv>
  <recv response="200"></recv>

  <ResponseTimeRepartition value="10, 20, 30, 40, 50, 100, 150, 200"/>
  <CallLengthRepartition value="10, 50, 100, 500, 1000, 5000, 10000"/>
</scenario>
